<?xml version="1.0" encoding="UTF-8"?>
<!-- OSCAL CATALOG METASCHEMA -->
<!-- validate with XSD and Schematron (linked) -->
<?xml-model href="../../build/metaschema/lib/metaschema-check.sch" type="application/xml" schematypens="http://purl.oclc.org/dsdl/schematron"?>
<?xml-stylesheet type="text/xsl" href="metaschema-browser.xsl"?>
<?xml-stylesheet type="text/css" href="../../build/metaschema/lib/metaschema-author.css"?>
<METASCHEMA xmlns:xsi="http://www.w3.org/2001/XMLSchema-instance"
 xsi:schemaLocation="http://csrc.nist.gov/ns/oscal/metaschema/1.0 ../../build/metaschema/lib/metaschema.xsd"
 xmlns="http://csrc.nist.gov/ns/oscal/metaschema/1.0" root="acquired-model">

  <schema-name>FAKEUP Testing Schema</schema-name>
  <short-name>module</short-name>
  <namespace>urn:fakeup2</namespace>
  <remarks>
    <p>A test schema for prototyping and demonstrating the metaschema feature set.</p>
    
  </remarks>

  
  <define-assembly name="acquired-model" group-as="acquired-models">
    <formal-name>Acquired Model</formal-name>
    <description>A string field, with mixed content</description>
    <remarks>
      <p>Defined in its own module!</p>
    </remarks>
    <model>
      <fields named="acquired-field" group-as="acquired-fields"/>
      <prose/>
    </model>
  </define-assembly>
  
  <define-field name="acquired-field" group-as="acquired-fields" as="mixed">
    <formal-name>Acquired Field</formal-name>
    <description>A string field, with mixed content</description>
    <remarks>
      <p>Defined in its own module!</p>
    </remarks>
    <example>
      <acquired-model  xmlns="urn:fakeup2">what's <em>up with this?</em></acquired-model>
    </example>
  </define-field>
  
</METASCHEMA>
