<?xml version="1.0" encoding="UTF-8"?>
<?xml-model href="../../build/metaschema/lib/metaschema-check.sch" type="application/xml" schematypens="http://purl.oclc.org/dsdl/schematron"?>
<?xml-stylesheet type="text/xsl" href="metaschema-browser.xsl"?>
<?xml-stylesheet type="text/css" href="../../build/metaschema/lib/metaschema-author.css"?>
<METASCHEMA xmlns:xsi="http://www.w3.org/2001/XMLSchema-instance"
 xsi:schemaLocation="http://csrc.nist.gov/ns/oscal/metaschema/1.0 ../../build/metaschema/lib/metaschema.xsd"
 xmlns="http://csrc.nist.gov/ns/oscal/metaschema/1.0" root="lunch">

  
  <schema-name>MINI Testing Schema</schema-name>
  <schema-version>testing</schema-version>
  <short-name>oscal-mini</short-name>
  <namespace>urn:mini</namespace>
  <remarks>
    <p>A test schema for prototyping and demonstrating the metaschema feature set.</p>
  </remarks>
  
 <define-assembly name="lunch">
    <formal-name>Lunch</formal-name>
    <description>lunch</description>
    <model>
      <assembly   named="salad"/>
      <assemblies named="sandwich"/>
      <fields     named="chip"/>
      <fields     named="cookie"/>
      <fields     named="cupcake"/>
    </model>    
  </define-assembly>

  <define-assembly name="sandwich" group-as="sandwiches">
    <key name="id" datatype="ID"/>
    <formal-name>Sandwich</formal-name>
    <description>Yeah....</description>
    <model>
      <prose/>
    </model>
  </define-assembly>
  
  <define-field name="chip" group-as="chips">
    <value-key name="type"/>
    <flag name="brand"/>
    
    <formal-name>Chip</formal-name>
    <description>Only one?</description>
  </define-field>
  
  <define-field name="cookie" group-as="cookies" collapsible="true">
    <value-key>type</value-key>
    <flag name="days"/>
    <flag name="baker"/>
    <formal-name>Cookie</formal-name>
    <description>Have several.</description>
  </define-field>
  
  <define-flag name="brand" datatype="string">
    <formal-name>Brand name</formal-name><description/>
  </define-flag>
  
  <define-flag name="days" datatype="string">
    <formal-name>Days available</formal-name><description/>
  </define-flag>
  
  <define-flag name="baker" datatype="string">
    <formal-name>Who baked it</formal-name><description/>
  </define-flag>
  
  <define-field name="cupcake" group-as="cupcakes">
    <flag name="icing"/>
    <formal-name>Cupcake</formal-name>
    <description>Most delicious.</description>
  </define-field>
  
  <define-flag name="icing" datatype="string">
    <formal-name>Type of icing</formal-name><description/>
  </define-flag>
  
  
  <define-assembly name="salad">
    <formal-name>Dump Truck</formal-name>
    <description/>
    <model>
      <fields named="masked-field"/>
      <fields named="labeled-value-field"/>
      <fields named="ID-object"/>
    </model>
  </define-assembly>
  
  <define-field name="masked-field" group-as="masked-fields">
    <!--<value-key name="name" datatype="string"/>-->
    <formal-name> </formal-name>
    <description/>
    <!-- in XML, produces an attribute named @name; in JSON,
         uses this to mask the form of the value -->
  </define-field>
  
  <define-field name="labeled-value-field" group-as="labeled-value-fields">
    <value-key>label</value-key> <!-- in XML, produces an attribute named @name; in JSON,
      uses this to mask the form of the value -->
    <formal-name> </formal-name>
    <description/>
  </define-field>

  <define-field name="ID-object" group-as="ID-objects">
    <key name="id" datatype="ID"/> 
    <!--<value-key name="big">big</value-key>-->
    
    <formal-name>Identified Flying Object</formal-name>
    <description/>
  </define-field>
  

</METASCHEMA>
